{
  "$schema": "https://json-schema.org/draft/2020-12/schema",
  "title": "KernForge request scenario replay matrix",
  "type": "array",
  "items": {
    "type": "object",
    "required": [
      "name",
      "user_text",
      "session_state",
      "provider_scripted_outputs",
      "expected_request_envelope",
      "expected_tool_exposure",
      "expected_interventions",
      "expected_final_gate"
    ],
    "properties": {
      "name": {
        "type": "string"
      },
      "user_text": {
        "type": "string"
      },
      "session_state": {
        "type": "object",
        "properties": {
          "messages": {
            "type": "array"
          },
          "changed_files": {
            "type": "array",
            "items": {
              "type": "string"
            }
          },
          "verification_status": {
            "type": "string"
          },
          "unresolved_verification": {
            "type": "boolean"
          },
          "generated_document_harness_owns_it": {
            "type": "boolean"
          },
          "orphan_tool_result": {
            "type": "boolean"
          },
          "compaction_history_rewrite": {
            "type": "boolean"
          }
        }
      },
      "provider_scripted_outputs": {
        "type": "array"
      },
      "semantic_classification": {
        "type": "object"
      },
      "expected_request_envelope": {
        "type": "object"
      },
      "expected_tool_exposure": {
        "type": "object"
      },
      "expected_interventions": {
        "type": "array",
        "items": {
          "type": "string"
        }
      },
      "expected_final_gate": {
        "type": "object"
      },
      "expected_semantic": {
        "type": "object",
        "properties": {
          "request_envelope": {
            "type": "object"
          },
          "tool_exposure": {
            "type": "object"
          },
          "final_gate": {
            "type": "object"
          },
          "differences": {
            "type": "array",
            "items": {
              "type": "string"
            }
          }
        }
      }
    }
  }
}
